{
  "schema_version": "pollen.tenant.v1",
  "tenant_id": "tenant-acme-prod",
  "tenant_type": "enterprise",
  "display_name": "ACME Production",
  "data_region": "ap-southeast-1",
  "trust_domain_strategy": "dedicated",
  "trust_domain": "tenant-acme.pollen.local",
  "policy_mode": "enforce",
  "default_fail_mode": "default_deny",
  "created_at": "2026-04-01T00:00:00Z"
}
